Код фактора,Фактор,Интерпретация
F1,Индекс потребительских цен,Отражает изменение уровня потребительских цен по товару или группе товаров
F2,Индекс доходов населения,Характеризует изменение доходов населения и потенциальную покупательную способность
F3,Запасы в днях,"Показывает обеспеченность товарными запасами, выраженную в днях торговли"
F4,Запасы в стоимостном выражении,Отражает объем товарных запасов в стоимостном выражении
F5,Динамика реализации,Характеризует изменение физического объема реализации товара
